{
  "$schema": "http://json-schema.org/draft-04/schema#",
  "type": "object",
  "properties": {
    "background": {
      "type": "string"
    },
    "soundtrack": {
      "type": "string"
    },
    "player": {
      "type": "object",
      "properties": {
        "image": {
          "type": "string"
        },
        "maneuverability": {
          "type": "integer"
        },
        "acceleration": {
          "type": "number"
        },
        "anim_on_destroy": {
          "type": "string"
        },
        "sound_on_impact": {
          "type": "string"
        },
        "damage": {
          "type": "integer"
        },
        "armor": {
          "type": "integer"
        },
        "primary_weapon": {
          "type": "object",
          "properties": {
            "damage": {
              "type": "integer"
            },
            "armor": {
              "type": "integer"
            },
            "speed": {
              "type": "integer"
            },
            "sound": {
              "type": "string"
            },
            "reload": {
              "type": "integer"
            },
            "image": {
              "type": "string"
            }
          },
          "required": [
            "damage",
            "armor",
            "speed",
            "sound",
            "reload",
            "image"
          ]
        },
        "secondary_weapon": {
          "type": "object",
          "properties": {
            "damage": {
              "type": "integer"
            },
            "armor": {
              "type": "integer"
            },
            "speed": {
              "type": "integer"
            },
            "sound": {
              "type": "string"
            },
            "reload": {
              "type": "integer"
            },
            "image": {
              "type": "string"
            }
          },
          "required": [
            "damage",
            "armor",
            "speed",
            "sound",
            "reload",
            "image"
          ]
        }
      },
      "required": [
        "image",
        "maneuverability",
        "acceleration",
        "anim_on_destroy",
        "sound_on_impact",
        "damage",
        "armor",
        "primary_weapon",
        "secondary_weapon"
      ]
    },
    "enemies": {
      "type": "array",
      "items": {
        "type": "object",
        "properties": {
          "tiers": {
            "type": "array",
            "items": {
              "type": "object",
              "properties": {
                "damage": {
                  "type": "integer"
                },
                "armor": {
                  "type": "integer"
                },
                "max_velocity": {
                  "type": "integer"
                },
                "min_velocity": {
                  "type": "integer"
                },
                "max_rotation": {
                  "type": "integer"
                },
                "scale": {
                  "type": [
                    "integer",
                    "number"
                  ]
                },
                "children": {
                  "type": "integer"
                },
                "sound_on_destroy": {
                  "type": "string"
                },
                "sound_on_impact": {
                  "type": "string"
                },
                "image": {
                  "type": "string"
                },
                "anim_on_destroy": {
                  "type": "string"
                }
              },
              "required": [
                "damage",
                "armor",
                "max_velocity",
                "min_velocity",
                "max_rotation",
                "scale",
                "children",
                "sound_on_destroy",
                "sound_on_impact",
                "image",
                "anim_on_destroy"
              ]
            }
          }
        },
        "required": [
          "tiers"
        ]
      }
    }
  },
  "required": [
    "background",
    "soundtrack",
    "player",
    "enemies"
  ]
}