{
    "background" : "background",
    "soundtrack" : "background",
    "player": {
        "image" : "spaceship",
        "maneuverability": 6,
        "acceleration" : 0.15,
        "anim_on_destroy" : "explosion8",
        "sound_on_impact": "hurt",
        "damage" : 5,
        "armor" : 1000,
        "primary_weapon": {
            "damage": 1,
            "armor" : 0,
            "speed": 8,
            "sound": "weapon1",
            "reload": 200,
            "image" : "bullet1"
        },
        "secondary_weapon": {
            "damage": 8,
            "armor" : 0,
            "speed": 4,
            "sound": "weapon2",
            "reload": 800,
            "image" : "bullet2"
        }
    },
    "enemies": [
        {
            "tiers": [
                {
                    "damage": 10,
                    "armor" : 1,
                    "max_velocity": 4,
                    "min_velocity": 1,
                    "max_rotation": 3,
                    "scale": 3,
                    "children": 70,
                    "sound_on_destroy": "explosion_big",
                    "sound_on_impact": "absorb1,absorb2,absorb3,absorb4",
                    "image": "planet-1",
                    "anim_on_destroy" : "explosion8"
                },
                {
                    "damage": 2,
                    "armor" : 4,
                    "max_velocity": 5,
                    "min_velocity": 2,
                    "max_rotation": 10,
                    "scale": 0.7,
                    "children": 6,
                    "sound_on_destroy": "explosion_medium",
                    "sound_on_impact": "absorb1,absorb2,absorb3,absorb4",
                    "image": "planet-1",
                    "anim_on_destroy" : "explosion8"

                },
                {
                    "damage": 1,
                    "armor" : 2,
                    "max_velocity": 10,
                    "min_velocity": 5,
                    "max_rotation": 0,
                    "scale": 0.3,
                    "children": 0,
                    "sound_on_destroy": "explosion_small",
                    "sound_on_impact": "absorb1_small,absorb2_small",
                    "image": "planet-1",
                    "anim_on_destroy" : "explosion2"
                }
            ]
        },

         {
            "tiers": [
                {
                    "damage": 10,
                    "armor" : 1,
                    "max_velocity": 4,
                    "min_velocity": 1,
                    "max_rotation": 3,
                    "scale": 2,
                    "children": 30,
                    "sound_on_destroy": "explosion_big",
                    "sound_on_impact": "absorb1,absorb2,absorb3,absorb4",
                    "image": "planet-3",
                    "anim_on_destroy" : "explosion8"
                },
                {
                    "damage": 2,
                    "armor" : 4,
                    "max_velocity": 5,
                    "min_velocity": 2,
                    "max_rotation": 10,
                    "scale": 0.7,
                    "children": 3,
                    "sound_on_destroy": "explosion_medium",
                    "sound_on_impact": "absorb1,absorb2,absorb3,absorb4",
                    "image": "planet-3",
                    "anim_on_destroy" : "explosion8"

                },
                {
                    "damage": 1,
                    "armor" : 2,
                    "max_velocity": 10,
                    "min_velocity": 5,
                    "max_rotation": 0,
                    "scale": 0.3,
                    "children": 0,
                    "sound_on_destroy": "explosion_small",
                    "sound_on_impact": "absorb1_small,absorb2_small",
                    "image": "planet-3",
                    "anim_on_destroy" : "explosion2"
                }
            ]
        },

         {
            "tiers": [
                {
                    "damage": 10,
                    "armor" : 10,
                    "max_velocity": 3,
                    "min_velocity": 1,
                    "max_rotation": 3,
                    "scale": 2,
                    "children": 3,
                    "sound_on_destroy": "explosion_big",
                    "sound_on_impact": "absorb1,absorb2,absorb3,absorb4",
                    "image": "planet-4",
                    "anim_on_destroy" : "explosion8"
                },
                {
                    "damage": 2,
                    "armor" : 4,
                    "max_velocity": 6,
                    "min_velocity": 3,
                    "max_rotation": 10,
                    "scale": 0.7,
                    "children": 3,
                    "sound_on_destroy": "explosion_medium",
                    "sound_on_impact": "absorb1,absorb2,absorb3,absorb4",
                    "image": "planet-4",
                    "anim_on_destroy" : "explosion8"

                },
                {
                    "damage": 1,
                    "armor" : 2,
                    "max_velocity": 10,
                    "min_velocity": 5,
                    "max_rotation": 0,
                    "scale": 0.3,
                    "children": 0,
                    "sound_on_destroy": "explosion_small",
                    "sound_on_impact": "absorb1_small,absorb2_small",
                    "image": "planet-4",
                    "anim_on_destroy" : "explosion2"
                }
            ]
        },

         {
            "tiers": [
                {
                    "damage": 10,
                    "armor" : 10,
                    "max_velocity": 3,
                    "min_velocity": 1,
                    "max_rotation": 3,
                    "scale": 2.5,
                    "children": 2,
                    "sound_on_destroy": "explosion_big",
                    "sound_on_impact": "absorb1,absorb2,absorb3,absorb4",
                    "image": "planet-5",
                    "anim_on_destroy" : "explosion8"
                },
                {
                    "damage": 2,
                    "armor" : 4,
                    "max_velocity": 5,
                    "min_velocity": 2,
                    "max_rotation": 10,
                    "scale": 1,
                    "children": 12,
                    "sound_on_destroy": "explosion_medium",
                    "sound_on_impact": "absorb1,absorb2,absorb3,absorb4",
                    "image": "planet-5",
                    "anim_on_destroy" : "explosion8"

                },
                {
                    "damage": 1,
                    "armor" : 2,
                    "max_velocity": 10,
                    "min_velocity": 5,
                    "max_rotation": 0,
                    "scale": 0.2,
                    "children": 0,
                    "sound_on_destroy": "explosion_small",
                    "sound_on_impact": "absorb1_small,absorb2_small",
                    "image": "planet-5",
                    "anim_on_destroy" : "explosion2"
                }
            ]
        }
    ]
}